{
  "schema_version": 1,
  "type": "content.archived",
  "delivery_policy": "archive",
  "source_state": "published",
  "publication_id": "example-publication",
  "event_id": "11111111-1111-4111-8111-111111111111",
  "content_id": "22222222-2222-4222-8222-222222222222",
  "object_instance": "22222222-2222-4222-8222-222222222222",
  "source": {
    "id": "content",
    "epoch": "1"
  },
  "revision": "1",
  "occurred_at": "2021-04-05T12:00:00Z",
  "document": {
    "visibility": "public",
    "title": "An older public article",
    "html": "<p>Original public article.</p>",
    "url": "https://example.org/blog/older-public-article",
    "published_at": "2020-03-04T12:00:00Z"
  }
}
